{
  "registry_version": "1.0.0",
  "generated_at": "2026-09-17T09:05:21Z",
  "dgv_benchmark_version": "1.0.0",
  "systems": [
    {
      "system_id": "only-engine",
      "system_name": "Only Engine",
      "system_version": "1.3.0",
      "publisher": {
        "name": "PIR Institute",
        "url": "https://github.com/vdmo"
      },
      "description": "Deterministic AI agent runtime with governance enforcement",
      "source_repository": "https://github.com/vdmo/only-engine",
      "certifications": [
        {
          "claim_id": "DGV-CL-001",
          "claim_name": "Deterministic Execution",
          "test_card_id": "DGV-TC-001",
          "test_card_version": "1.0.0",
          "execution_mode": "native",
          "svrnos_layer": "L6: Risk Interpretation",
          "badge_status": "verified:native",
          "certified_at": "2026-08-31T12:26:40Z",
          "expires_at": "2027-08-31T12:26:40Z",
          "evidence": {
            "package_uri": "evidence/dgv_tc_001_evidence.json",
            "receipt": {
              "anchor_method": "sha256-content-hash",
              "transaction_id": "dgv-sha256:4ceb239e0c98984aa663a00d5a831a61999eccdb09db06beed4cc754f68775e6",
              "timestamp": "2026-08-31T12:26:40Z"
            }
          }
        },
        {
          "claim_id": "DGV-CL-002",
          "claim_name": "Boundary Enforcement",
          "test_card_id": "DGV-TC-002",
          "test_card_version": "1.0.0",
          "execution_mode": "native",
          "svrnos_layer": "L6: Risk Interpretation",
          "badge_status": "verified:native",
          "certified_at": "2026-08-31T12:26:40Z",
          "expires_at": "2027-08-31T12:26:40Z",
          "evidence": {
            "package_uri": "evidence/dgv_tc_002_evidence.json",
            "receipt": {
              "anchor_method": "sha256-content-hash",
              "transaction_id": "dgv-sha256:7a932087ffc6c6f4f525f6fbf0c2321417c1dca37f18de30902d21eb6d0f78b3",
              "timestamp": "2026-08-31T12:26:40Z"
            }
          }
        },
        {
          "claim_id": "DGV-CL-003",
          "claim_name": "Policy-Compliant Execution",
          "test_card_id": "DGV-TC-003",
          "test_card_version": "1.0.0",
          "execution_mode": "native",
          "svrnos_layer": "L7: Application Enforcement",
          "badge_status": "verified:native",
          "certified_at": "2026-08-31T12:26:40Z",
          "expires_at": "2027-08-31T12:26:40Z",
          "evidence": {
            "package_uri": "evidence/dgv_tc_003_evidence.json",
            "receipt": {
              "anchor_method": "sha256-content-hash",
              "transaction_id": "dgv-sha256:3b65439a776d15e090c6b6a6d9e3bf521e80289ef4dc4f6a6edf165c91833c1f",
              "timestamp": "2026-08-31T12:26:40Z"
            }
          }
        },
        {
          "claim_id": "DGV-CL-004",
          "claim_name": "Instruction Hierarchy Obedience",
          "test_card_id": "DGV-TC-004",
          "test_card_version": "1.0.0",
          "execution_mode": "native",
          "svrnos_layer": "L6: Risk Interpretation",
          "badge_status": "verified:native",
          "certified_at": "2026-08-31T12:26:40Z",
          "expires_at": "2027-08-31T12:26:40Z",
          "evidence": {
            "package_uri": "evidence/dgv_tc_004_evidence.json",
            "receipt": {
              "anchor_method": "sha256-content-hash",
              "transaction_id": "dgv-sha256:b68459dcf1e68c63e5d133d1877088c1fee91541c024a90b052d04e135ca6e8d",
              "timestamp": "2026-08-31T12:26:40Z"
            }
          }
        },
        {
          "claim_id": "DGV-CL-005",
          "claim_name": "Refusal Correctness",
          "test_card_id": "DGV-TC-005",
          "test_card_version": "1.0.0",
          "execution_mode": "native",
          "svrnos_layer": "L7: Application Enforcement",
          "badge_status": "verified:native",
          "certified_at": "2026-08-31T12:26:40Z",
          "expires_at": "2027-08-31T12:26:40Z",
          "evidence": {
            "package_uri": "evidence/dgv_tc_005_evidence.json",
            "receipt": {
              "anchor_method": "sha256-content-hash",
              "transaction_id": "dgv-sha256:1f333aaf14f73ca85401ea7038599ac60c68fcdf90e54b4c07846e4cd9b97c73",
              "timestamp": "2026-08-31T12:26:40Z"
            }
          }
        },
        {
          "claim_id": "DGV-CL-006",
          "claim_name": "Audit Log Completeness",
          "test_card_id": "DGV-TC-006",
          "test_card_version": "1.0.0",
          "execution_mode": "native",
          "svrnos_layer": "L4: Evidence Transport",
          "badge_status": "verified:native",
          "certified_at": "2026-08-31T12:26:40Z",
          "expires_at": "2027-08-31T12:26:40Z",
          "evidence": {
            "package_uri": "evidence/dgv_tc_006_evidence.json",
            "receipt": {
              "anchor_method": "sha256-content-hash",
              "transaction_id": "dgv-sha256:b6c764576b476f3520fb988c2611bfdd6a17aaccc6bcda5e01ae54219abfdd2c",
              "timestamp": "2026-08-31T12:26:40Z"
            }
          }
        },
        {
          "claim_id": "DGV-CL-007",
          "claim_name": "Provenance Traceability",
          "test_card_id": "DGV-TC-007",
          "test_card_version": "1.0.0",
          "execution_mode": "native",
          "svrnos_layer": "L2: Component & Provenance",
          "badge_status": "verified:native",
          "certified_at": "2026-08-31T12:26:40Z",
          "expires_at": "2027-08-31T12:26:40Z",
          "evidence": {
            "package_uri": "evidence/dgv_tc_007_evidence.json",
            "receipt": {
              "anchor_method": "sha256-content-hash",
              "transaction_id": "dgv-sha256:a2b7a205ec05096e2e2aa01ea530d47a228d0643d8c15f6f96e6a3a73bb9b910",
              "timestamp": "2026-08-31T12:26:40Z"
            }
          }
        },
        {
          "claim_id": "DGV-CL-008",
          "claim_name": "Stability Under Repeated Runs",
          "test_card_id": "DGV-TC-008",
          "test_card_version": "1.0.0",
          "execution_mode": "native",
          "svrnos_layer": "L5: Session & State",
          "badge_status": "verified:native",
          "certified_at": "2026-08-31T12:26:40Z",
          "expires_at": "2027-08-31T12:26:40Z",
          "evidence": {
            "package_uri": "evidence/dgv_tc_008_evidence.json",
            "receipt": {
              "anchor_method": "sha256-content-hash",
              "transaction_id": "dgv-sha256:76148bd1674df943588ff7f36d3b6e1bf18aaea4abcb4f36328e7d810b12b1a5",
              "timestamp": "2026-08-31T12:26:40Z"
            }
          }
        },
        {
          "claim_id": "DGV-CL-009",
          "claim_name": "Token Replay Resistance",
          "test_card_id": "DGV-TC-009",
          "test_card_version": "1.0.0",
          "execution_mode": "native",
          "svrnos_layer": "L2: Component & Provenance",
          "badge_status": "verified:native",
          "certified_at": "2026-08-31T12:26:40Z",
          "expires_at": "2027-08-31T12:26:40Z",
          "evidence": {
            "package_uri": "evidence/dgv_tc_009_evidence.json",
            "receipt": {
              "anchor_method": "sha256-content-hash",
              "transaction_id": "dgv-sha256:558529301452580d8a9ed238c6b6d60b2554ab566a938359f413907633d4889a",
              "timestamp": "2026-08-31T12:26:40Z"
            }
          }
        },
        {
          "claim_id": "DGV-CL-010",
          "claim_name": "Fail-Closed Latency",
          "test_card_id": "DGV-TC-010",
          "test_card_version": "1.0.0",
          "execution_mode": "native",
          "svrnos_layer": "L7: Application Enforcement",
          "badge_status": "verified:native",
          "certified_at": "2026-08-31T12:26:40Z",
          "expires_at": "2027-08-31T12:26:40Z",
          "evidence": {
            "package_uri": "evidence/dgv_tc_010_evidence.json",
            "receipt": {
              "anchor_method": "sha256-content-hash",
              "transaction_id": "dgv-sha256:faa0b6e018ec76726aa1354faf66af1d0304647ad737591159a8f1822b68732e",
              "timestamp": "2026-08-31T12:26:40Z"
            }
          }
        },
        {
          "claim_id": "DGV-CL-011",
          "claim_name": "Explanation & Decision Traceability",
          "test_card_id": "DGV-TC-011",
          "test_card_version": "1.0.0",
          "execution_mode": "native",
          "svrnos_layer": "L6: Risk Interpretation",
          "badge_status": "verified:native",
          "certified_at": "2026-08-31T12:26:40Z",
          "expires_at": "2027-08-31T12:26:40Z",
          "evidence": {
            "package_uri": "evidence/dgv_tc_011_evidence.json",
            "receipt": {
              "anchor_method": "sha256-content-hash",
              "transaction_id": "dgv-sha256:03e6c13639c2a1272e4a07778e8f65848c4d475f6fa270e334187151005e6479",
              "timestamp": "2026-08-31T12:26:40Z"
            }
          }
        },
        {
          "claim_id": "DGV-CL-012",
          "claim_name": "Adversarial Prompt Resistance",
          "test_card_id": "DGV-TC-012",
          "test_card_version": "1.0.0",
          "execution_mode": "native",
          "svrnos_layer": "L3: Routing & Boundary",
          "badge_status": "verified:native",
          "certified_at": "2026-08-31T12:26:41Z",
          "expires_at": "2027-08-31T12:26:41Z",
          "evidence": {
            "package_uri": "evidence/dgv_tc_012_evidence.json",
            "receipt": {
              "anchor_method": "sha256-content-hash",
              "transaction_id": "dgv-sha256:3ae7388de8824afa0ca44280f6f513d8326129d5d56642af0b9d9f8b296f2424",
              "timestamp": "2026-08-31T12:26:41Z"
            }
          }
        },
        {
          "claim_id": "DGV-CL-013",
          "claim_name": "Statistical Fairness & Bias Mitigation",